,lang,class,message,created_time,month,year,platform,username
485,filipino,n,tanong ko lang po bakit kailangang laging naiipit ang mga tao sa situation natin ngayon ? may balita po kasi na kapag hindi nagpa bakuna ang isang tao ngayon ..darating na ng panahon na kailangan na nya ng bakuna may babayaran na sya ng malaki ? bakit parang pinipilit nyo ang mga taong ayaw magpa bakuna? pag nagpabakuna ba ang isang tao pwd naba siyang mag biyahe nang malayo at saang lugar?,2021-03-29 12:45:51+00:00,march,2021.0,Facebook,
486,filipino,n,covid lumas kana sa pilipinas in jesus name,2021-04-29 13:46:31+00:00,april,2021.0,Facebook,
487,filipino,n,trangkaso lang iyan covid na agad,2021-04-29 13:48:04+00:00,april,2021.0,Facebook,
488,english,n,"no swab test, no covid.",2021-04-29 14:53:24+00:00,april,2021.0,Facebook,
489,english,n,don't covid unto others what you want others not to covid unto you.,2021-04-29 14:55:12+00:00,april,2021.0,Facebook,
490,filipino,n,bakit 15k lang makukuha ng nagpositive sa covid? wala naman silang sahod pag naka 14 days quarantine ang mga nurse,2021-04-29 15:04:13+00:00,april,2021.0,Facebook,
491,english,n,fraud covid,2021-04-29 15:04:54+00:00,april,2021.0,Facebook,
492,filipino,n,unang bakuna nga wala pa eh,2021-04-29 10:20:01+00:00,april,2021.0,Facebook,
493,english,n,vaccine is a anti novel virus covid 19,2021-04-29 10:20:13+00:00,april,2021.0,Facebook,
494,english,n,"in manila, we were informed that the 2nd dose was on april 25, 2021 but it did not happen maybe because of lack of supply of vaccine. will the 2nd dose vaccination for senior citizens proceed? can anyone from manila govt update us on the matter?",2021-04-29 10:26:58+00:00,april,2021.0,Facebook,
495,filipino,n,"suggest ko lang po sobrang hirap huminga pag may mask at faceshield, sumasakit ulo ko, walang hangin malanghap na fresh,pag tumagal, mukhang di ok yong sistema na yan sa pangmatagalan lalo pag babad sa init na area tulad sa construction site.",2021-04-29 10:40:29+00:00,april,2021.0,Facebook,
496,filipino,n,"pag nabakunahan na, may protocols pa rin bang susundin upon entry to the philippines",2021-04-29 10:46:39+00:00,april,2021.0,Facebook,
497,english,n,is this fake news again or being covered-up by media and super rich family?,2021-04-29 10:53:50+00:00,april,2021.0,Facebook,
498,filipino,n,salamat po kompleto na po 2 dose ng bakuna ko taga tondo po ako.,2021-04-29 10:55:17+00:00,april,2021.0,Facebook,
499,filipino,n,tuloy pa rin ang mass recovery kahit na mas marami pa ang nagkumpirma sa covid!,2021-04-29 08:00:21+00:00,april,2021.0,Facebook,
500,english,n,the sooner everyone realizes vaccinations are the only way out of this pandemic the better off all of the world will be. i wish there was another way but i certainly don't see it.,2021-04-29 08:03:28+00:00,april,2021.0,Facebook,
501,english,n,just wear the mask just get the vaccine just get in the truck just line up against the wall,2021-04-29 01:36:01+00:00,april,2021.0,Facebook,
502,taglish,n,"while others may have already lost their faith in the government, i will stay believing that god as the ultimate all-knowing persona has appointed you. god bless you, pilipinas-our inang bayan! 😇🙏💕",2021-04-29 01:37:52+00:00,april,2021.0,Facebook,
503,english,n,doh we trust in you. you think well you feel well you do well please. do not be bothered by detractors just focus to fight against covid 19 -just respect the opinions and freedom of expressions of some responsible citizens.,2021-04-29 01:42:52+00:00,april,2021.0,Facebook,
504,english,n,as of now i am still observing the good and bad result upon the vaccine,2021-04-29 01:43:18+00:00,april,2021.0,Facebook,
505,english,n,alright lets do it! support the government efforts on this covid 19 vaccination and follow other health protocols! good luck everyone! always keep safe!,2021-04-29 01:45:03+00:00,april,2021.0,Facebook,
506,filipino,n,many doctors said that vaccine is not a 100 percent but only 50 percent assurance to control and protect the covid 19 but only god knows,2021-04-29 01:50:40+00:00,april,2021.0,Facebook,
507,english,n,fake covid fake vaccine,2021-04-29 00:01:17+00:00,april,2021.0,Facebook,
508,taglish,n,"panay explain kayo ng ibat ibang covid19 vaccine brands eh sinovac at astra lang naman pinamimigay nyo. on top of that, di pa namin maramdaman sa category b ang vaccine na yan. asan na ang vaccine?",2021-04-29 00:05:04+00:00,april,2021.0,Facebook,
509,filipino,n,after sinovac vaccine nmn ng russia pinopromote yung top choice ng pinoy kya na pfizer kailan nyo ma hanapan ng paraan para mkakuha,2021-04-29 00:07:11+00:00,april,2021.0,Facebook,
510,taglish,n,pareho-pareho ba ang formulation ng mga vaccine?,2021-04-29 00:17:03+00:00,april,2021.0,Facebook,
511,taglish,n,"ang mga nagrereklamo, please huwag nalang mag pa vaccine..you are not forced to do so..so please shut up nalng kng pwede..else gumawa nalng kayo ng sarili nyong vaccine 👍",2021-04-29 00:20:14+00:00,april,2021.0,Facebook,
512,filipino,n,"ang mga nagrereklamo, please huwag nalang mag pa vaccine you are not forced to do so, so please shut up nalang kung pwede or else gumawa nalng kayo ng sarili niyong vaccine 👍",2021-04-28 13:33:36+00:00,april,2021.0,Facebook,
513,filipino,n,ano nangyari sa bagong variant daw ng covid na pinapauso niyo noon? di kinagat ng tao kaya namatay ang issue halatang imbento. dami nyo alam! mga corrupt!,2021-04-28 14:15:30+00:00,april,2021.0,Facebook,
514,filipino,n,"simple lang ang style ng covid, kapag takot ka at stress aatakihin ka ng mataas na air pollution mabilis lumala ang sakit",2021-04-28 20:05:10+00:00,april,2021.0,Facebook,
515,filipino,n,"di ko po maintindihan, naging positive ako sa covid 😅 nagka lagnat ako dahil sa uti pero ginawang covid. okay po. salamat sa perwisyo.",2021-04-28 21:34:42+00:00,april,2021.0,Facebook,
516,taglish,n,gamot sa covid think positive,2021-04-28 22:51:05+00:00,april,2021.0,Facebook,
517,taglish,n,"doktor ng ospital na may first dose ng bakuna, dinapuan ng covid-19, patay",2021-04-28 13:01:33+00:00,april,2021.0,Facebook,
518,taglish,n,"pag namatay sa flu at pulmonya, report nyan ay covid-19. kaya nga nawala na numbers ng namamatay sa flu at pulmonya paramihan ng covid cases reported ",2021-04-28 13:04:07+00:00,april,2021.0,Facebook,
519,filipino,n,sana may libre na pang flu at pneumonia para lahat mahihirap makatangap mahal kasi pag nagpainject ka pag private,2021-04-28 13:04:25+00:00,april,2021.0,Facebook,
520,filipino,n,bakunahan nyo na mga ulo nyo nag papauto kayo lagi sa goberno gusto nila kayong patayin kemikal turok doon turok dito rekta nyo na yan sa ulo nyo,2021-04-28 13:08:37+00:00,april,2021.0,Facebook,
521,filipino,n,darwin nicasa nagpabakuna kami mga seniors anti flu anti pneumonia ng free lang po,2021-04-28 13:42:26+00:00,april,2021.0,Facebook,
522,filipino,n,sana may free vaccines for pneumonia and flu in our region.,2021-04-28 13:44:22+00:00,april,2021.0,Facebook,
523,filipino,n,puro lang kayo vaccine vaccine ni walang kasiguruhan puro lang advertise at endorso ng bakunang gawa ng ibang bansa.,2021-04-28 13:11:30+00:00,april,2021.0,Facebook,
524,taglish,n,gumawa kayo ng sarili nyong vaccine yung totoo nakaka pag prevent ng mga tunay na sakit bago kayo mag endorso huwag nyong gawing dependent sa bakuna ng ibang bansa ang mga mamamayan ng ating bansa.huwag nyong pagexperimentuhan kapwa nyo.,2021-04-28 13:24:20+00:00,april,2021.0,Facebook,
525,filipino,n,sana kahit bakuna sa pneumonia ay mabakunahan po ako,2021-04-28 20:17:35+00:00,april,2021.0,Facebook,
526,filipino,n,"doh, moringga lang ang katapat ng covid..hindi na kasi kilala ng mga tao ang mga gulay.",2021-04-28 11:57:09+00:00,april,2021.0,Facebook,
527,filipino,n,unahin mabakunahan ang ncr bubble dahil dito ang sentro ng ekonomiya at may pinakamaraming nagtatrabaho na nawalan.,2021-04-28 14:49:26+00:00,april,2021.0,Facebook,
528,english,n,how can we get covid vaccine online registration form for non-seniors?,2021-04-28 18:20:08+00:00,april,2021.0,Facebook,
529,filipino,n,araw araw sana pababa ang covid at pataas naman ang recovered 🙏🙏🙏,2021-04-28 08:13:56+00:00,april,2021.0,Facebook,
530,english,n,"so 5 hospitals have now been given permission to use ivermectin. funny how the media, and others, who were up in arms about how dangerous ivermectin is, suddenly are quiet, not asking about how many deaths or adverse effects have occurred in the first 3 hospitals fda gave permission to that have been dispensing ivermectin. i guess they're afraid they'll be proven wrong -- that ivermectin has proven safe and effective, so they don't want this news to leak out.",2021-04-28 07:37:43+00:00,april,2021.0,Facebook,
531,filipino,n,masyado nyo lang tinatakot ang sarili nyo sa sinasabing covid di totoo yan,2021-04-28 14:47:41+00:00,april,2021.0,Facebook,
532,filipino,n,kahit magpabakuna ka pwede ka pa rin tamaan ng covid,2021-04-28 06:14:17+00:00,april,2021.0,Facebook,
533,filipino,n,"ang dami nanaman expert magcomment dito, e parating pa lang mga vaccine, march na nga naumpisahan yan, mas mabilis pa tayo sa ibang mga bansa",2021-04-28 06:37:19+00:00,april,2021.0,Facebook,
534,filipino,n,kayo nalang pavaccine tiwala na ako kay lord at sa imyon system k,2021-04-28 06:04:08+00:00,april,2021.0,Facebook,
535,filipino,n,covid vaccine moringga lang ang katapat niya...,2021-04-28 09:40:48+00:00,april,2021.0,Facebook,
536,taglish,n,"alex reyes don't get confused. hindi naman sinabi na ""magpakuna ulit"" after the 1st dose ng sinovac, aztra zeneca naman. it's understood na one brand lang ng vaccine sa 1st & 2nd dose.",2021-04-27 12:33:42+00:00,april,2021.0,Facebook,
537,filipino,n,dami covid idiots. gawa gawa lang yong pandemic sa india. hindi na kayo natuto,2021-04-27 14:15:48+00:00,april,2021.0,Facebook,
538,filipino,n,pag nagpabakuna ba mga tao di na kami magkakasakit o mamamatay?,2021-04-27 13:28:26+00:00,april,2021.0,Facebook,
539,filipino,n,sana madagdagan pa ang mga gagaling sa covid!!,2021-04-27 08:00:24+00:00,april,2021.0,Facebook,
540,english,n,i'm over trying to deal with this whole covid thing,2021-04-27 08:01:57+00:00,april,2021.0,Facebook,
541,filipino,n,sana nabibigyan ng penalty ng doh yung mga laboratoryong hindi regular na nakakapag-submit ng datos nila para masiguro ang tama at maayos na pagtatala ng mga bilang ng kaso ng covid.,2021-04-27 08:03:06+00:00,april,2021.0,Facebook,
542,taglish,n,mahina parin tayo sa contact tracing kaya hindi accurate ang bilang ng active cases sa bansa😁,2021-04-27 08:03:53+00:00,april,2021.0,Facebook,
543,taglish,n,why not release the vaccine that was delivered last week pa??,2021-04-27 05:39:24+00:00,april,2021.0,Facebook,
544,taglish,n,thanks po willing po ako nagpavaccine if available n because kung ito lng po paraan para mktulong sa government or sa ikkbuti ng lht mrami na po akong kaibigan ksamahan kmaganak n magpaturok ng vaccine ok nmn po sila at mkkasihat ko po sila but i am not encouraging anyone if you take it or leave it thanks department of health saludo po ako sainyo at sa ating butihing presidents duterte thanks sir mabuhay ka po..,2021-04-27 05:47:57+00:00,april,2021.0,Facebook,
545,filipino,n,sigurado ba talagang walang kapalit yung vaccines na dinonate ng china? kasi baka bukas makalawa eh gumising nalang tayo na hindi na pilipinas ang pangalan ng ating bansa.,2021-04-27 05:48:40+00:00,april,2021.0,Facebook,
546,taglish,n,ano po ba ang protocol sa mga asymptomatic covid-19 case na nag home isolation na ng 10 days? hindi na ba required ang swab or any testing para ma validate na negative na ang pasyente? automatic ba na ma-consider negative na ang pasyente kung sa loob ng 10 days ay walang any symptoms na lumabas? allowed ba silang lumabas ng bahay after 10days kahit wala pang certificate na nagpapatunay na hindi na sila carrier ng covid-19?,2021-04-27 05:16:36+00:00,april,2021.0,Facebook,
547,english,n,"doh the problem is the implementation of community quarantine. you are forcing the non-infected to be infected by people who contracted covid. how to lessen the covid case: persons from young to adult age are free to go outside but they are force to wear double mask to prevent airborne transmission, lockdown specific areas of quezon city wherein covid cases are commonly present, when in places such as work people are mandatory to wear surgical gloves.",2021-04-26 14:48:44+00:00,april,2021.0,Facebook,
548,taglish,n,"to convince the population in accepting the vaccine sana ang iatf at doh ay maglunsad ng vaccine campaign/commercial na magbibigay ng mas malawig na information, at facts tungkol sa vaccines na ipapamahagi at mga benepisyo ng pagpapabakuna. bigyan din po sana lahat ng nabakunahan ng incentive by easing up their quarantine period when they're traveling para mas mahikayat ang karamihan na magpa bakuna na kapag pwede na.",2021-04-26 19:39:23+00:00,april,2021.0,Facebook,
549,english,n,why make a vaccine when there's so many to choose from? this baffles me!,2021-04-26 19:22:39+00:00,april,2021.0,Facebook,
550,taglish,n,ano naman ang kinalaman ng utilities sa covid-19 vaccines.,2021-04-27 02:53:47+00:00,april,2021.0,Facebook,
551,filipino,n,mga sakitin lang dapat at may sakit ang bakunahan,2021-04-26 14:36:09+00:00,april,2021.0,Facebook,
552,taglish,n,"please identify lgus that will receive sputnikv, pfizer and moderna para hindi naman sobra mag expect mga filipino sa vaccine na ibibigay ng gobyerno. marami may brand preference para naman mahanda na nila sarili nila na ang mga vaccines na hindi kelangan ng ultra cold freezers ang darating sa lugar nila. please set the expectations now please",2021-04-25 14:16:49+00:00,april,2021.0,Facebook,
553,taglish,n,"dear doh, kasalukuyan po na naka-confine ang nanay ko po and diagnosed severe covid19 pneumonia. ang sabi po ng doctor need namin pagsabayin yung remdesivir (amounting to 21k) and hemoperfusion. nahihirapan po kami humanap ng pondo pambili ng cartridge po ng hemoperfusion. dahil ang isa po nito ay 35k. need po kasi ng 4 sa buong hemoperfusion. wala pong cartridges and remdesivir sa ospital ng nanay ko po. sana po may choices po kami na makabili ng mas murang cartridges :(",2021-04-25 06:08:20+00:00,april,2021.0,Facebook,
554,taglish,n,saan po kaya pwede magpa vaccine? mmda contact tracer po ako and until now si pa po nkapag pa-vaccine.,2021-04-24 12:13:31+00:00,april,2021.0,Facebook,
555,taglish,n,"malamang maraming vaccine ang masasayang kasi may time pa kayo mag ""debunks"". meaning, maraming vaccine ang hindi pa nabibigay sa mga taong nakaschedule for vaccination. kapag naexpire isisisi sa taong bayan. #napanoodnanaminyan!",2021-04-24 12:58:49+00:00,april,2021.0,Facebook,
556,filipino,n,hay nako mga taga doh dami nyong alam at problema sa buhay kung gusto nyong mawala ang covid pabakuran nyo ng pader na simento yong bondery ng bawat lalawigan tutal wala naman nakakabyahe na at mag isip kayo ng solusyon puro lang kayo ngawa wala naman sa gawa,2021-04-24 12:58:57+00:00,april,2021.0,Facebook,
557,english,n,"we must freely act together with science and truth it is a fact that ivermectin is safe and efficacious against early phases of covid-19 including prophylaxis. there are other cost-effective public health interventions that can cut significantly covid-19 infections and diseases other than the new, experimental covid-19 vaccines peddled by doh-iatf duque, fda domingo and pchrd montoya and gloriani. enough with the lies, propaganda and corporate greed of the big pharmas and the well paid, controlled who, cdc usa, international and local msm, doh-fda-philhealth and doctor agents of multinational pharmaceuticals like duque, garin, domingo, vergerie, vega, solante, montoya, gloriani, salvana, herbosa, bravo, cabral, leachon, co, dans, tamesis, padilla and limpin. furthermore, we must be forewarned of the octa research group. it is funded by powerful and wealthy politicians who are supporting the manchurian candidate. it has zero expertise and experience in public health, epidemiology, outbreak investigations, health strategy planning and behavioral change communication. it is temporarly a sleeper cell to compete with sws and pulse asia as 2022 pollsters. the battle is clearly defined. there are god-fearing, competent, patriotic and independent filipino physician experts like dr. romy quijano, dr. iggy agbayani and cdc philippines. we shall overcome and bring back health in the hands of the people. francisco salcedo cruz, md, mph. public health vaccination expert",2021-04-24 11:02:54+00:00,april,2021.0,Facebook,
558,taglish,n,"harold semacio halton kahit magkaroon pa po ng mga bakuna laban sa covid, hindi na po yan mawawala o matatapos. kahit kasi nabakunhan na po tayo, tatamaan pa rin po tayo ng covid na yan. meaning, hindi pa rin po mapuputol ang hawaan ng covid. wala naman po kasing bakuna na may 100% na proteksyon o immunity at wala rin pong bakuna na may life time na proteksyon o immunity. covid is here to stay with us.",2021-04-24 11:07:07+00:00,april,2021.0,Facebook,
559,filipino,n,wala naman pong pagsubok ng hindi po nasusulosyonan po basta po mag pray lng po tayo sa panginoon na mawala na ang covid 19 at patuloy lang po tayo magdasal dahil po pinapakinggan po tayo ng panginoon po,2021-04-24 11:18:58+00:00,april,2021.0,Facebook,
560,filipino,n,wala! mas magaling pa din ang immune system ko kaysa sa bakuna. itigil niyo na panloloko niyo.,2021-04-24 10:07:55+00:00,april,2021.0,Facebook,
561,filipino,n,bakunahan nyo sarili nyo,2021-04-24 10:57:38+00:00,april,2021.0,Facebook,
562,taglish,n,sa mga nababalak magpabakuna unahin nyo muna kumuha ng st.peter plan.para hnd nmn kawawa ang maiiwanan at pabayaran nyo muna sa doh para hnd na mamuroblima kapamilya nyo.maganda na yong nka plano.total nagplaplano nmn kayo magpakamatay lubusin nyo na ang plano nyo st.peter plan kahit saan kahit kaylan maasahan.mabilus ang serbesyo..😂😂😂,2021-04-24 11:17:33+00:00,april,2021.0,Facebook,
563,taglish,n,"thank you sa advisory but we need the vaccine. ready na kami magpabakuna, kayo ang wala pang maibigay. buhos nyo muna effort nyo sa pag procure ng vaccines",2021-04-24 11:35:12+00:00,april,2021.0,Facebook,
564,filipino,n,"doh officials and health workers, please, please practice due diligence and common sense with conscience, how can you implement the covid vaccines if you have not thoroughly assessed and evaluated the safety, efficacy of each vaccine you are imposing to the filipino people specially the health workers, frontliners, government employees. para sa hindi pa nakaka-basa sa aking post tungkol pangyayari sa isang pilipina sa germany. siya po ay nagkaroon at tinamaan ng coronavirus variant kahit pa kumpleto ang covid-19 vaccine. ito po ay napa-balita kanina lang sa gma7, april 20, 2021. isang patunay na nag-sasabi ng totoo ang eksperto sa bakuna na dr. gerrt vende besshe sa kanyang video warning tungkol sa mrna vaccine. kaya gusto ko na ulit-ulitin ang panawagan sa aking mga kababayang pilipino na huwag po kao maniwala sa kasinungalingan ng iatf-doh at mga lgu officials na mapro-protektahan kayo pag naturukan na kayo ng covid vaccine. gagawin lang tayon guinea pigs at ginagawang sacrificial lamb ng mga corrupt at mayayamang capitalista sa likod ng covid vaccines. uulitin ko pa ang aking panawagan na pakinggan ninyong mabuti ang warning tungkol sa bakuna. eto pa ang video warning galing sa tunay na eksperto sa bakuna. isa siya sa tumulong gumawa ng maraming bakuna para sa buong mundo, at naka-sama ang mag-asawang donna at bill gates.",2021-04-24 05:31:57+00:00,april,2021.0,Facebook,
565,filipino,n,walang covid copit lang meron marami!,2021-04-24 03:10:19+00:00,april,2021.0,Facebook,
566,taglish,n,pag namasyal hindi importante? socialising is important tinuturo natin ito sa mga bata di ba? seasonal virus na yan at hindi yang virus na yan ang magdidikta na paggalaw natin sa mundo. nobody will leave this world alive kahit healthy ka pa. huwag tayong mabuhay na puro takot sa isang virus na tulad ng covid.,2021-04-24 04:43:07+00:00,april,2021.0,Facebook,
567,filipino,n,edgardo trinidad wala pa iyan maski swabtest di perfect check youtube government of cebu. test is fake. dahil yan ang ginagamit even the inventor said his inventions not for covid but for dna,2021-04-24 05:23:24+00:00,april,2021.0,Facebook,
568,taglish,n,mas makaka matay payang fake mask at fake shield kesa sa covid kung may covid talaga🤔,2021-04-24 05:40:21+00:00,april,2021.0,Facebook,
569,filipino,n,"may tanong po ko di ko kasi ma pm kaya dito na lang po sa comment box ""pagka tapos po ba bakunahan ay pwede na uminom ng alak or hindi?""",2021-04-23 11:16:32+00:00,april,2021.0,Facebook,
570,taglish,n,pampabata ang covid vaccine,2021-04-24 15:07:27+00:00,april,2021.0,Facebook,
571,english,n,"what kind of doh officials are you, trying to destroy the filipino culture of hospitality that we are famous for throughout the world? just because of your own fear and believing covid is pandemic which in reality is not, you have to impose directive that is a violation of people's constitutional rights. your idiotic minds is eroding most good filipino values and believing all the lies about the coronavirus who conspired for money and power. to the extent of promoting covid vaccines that safety and efficacy are still not possible at this early stage. how could you people in fda and doh afford to sacrifice lives of filipino families? your arrogance being in health officials is uncalled for because you are paid by the people's tax money. so you are complicit to this crime of mankind!",2021-04-24 02:24:06+00:00,april,2021.0,Facebook,
572,english,n,"useless when every offices are closed, including educational institutions that needs to catch up and graduate. #reopen",2021-04-23 10:12:50+00:00,april,2021.0,Facebook,
573,filipino,n,alam kopa ang ginagawa ko.natupad naman ako .inaalagaan ko din ang kalusugan ko.kung may covid ako noon pa patay na ang mga kasama ko sa bahay at yong mga nakasalamuha ko. bakit mo nasa bing may mental health ako nakikita mo ba ako araw-araw .kaya kong alagaan ang sarili ko.,2021-04-23 20:49:16+00:00,april,2021.0,Facebook,
574,english,n,"in a country where most people do not have the slighest idea about infectious diseases and viruses, there is no other way to stop the pandemic but thru vaccination. people contract covid because they are ignorant, reckless and unhygienic. there is no treatment to being stupid.",2021-04-23 11:26:45+00:00,april,2021.0,Facebook,
575,english,n,"this is the kind of stupid mentality that's causing the steady increase in covid cases and death in the philippines. you have zero iq as far as vaccines and infectious diseases are concerned. ignorance kills, mind you.",2021-04-23 11:32:19+00:00,april,2021.0,Facebook,
576,taglish,n,"doh, mag isip kayo ng mabuti para matapus na ito ang covid2. kaso lang pag wala na ang covid wala na ang business sa pag benta ng face mask,face shield,ppe at swab test.. trangkaso lang ang covid madaling gamotin .pag may naramdaman naikaw gamotin kaagad..huwag hintayin na lumala pa.",2021-04-23 07:21:14+00:00,april,2021.0,Facebook,
577,filipino,n,dasal lang katapat ko wala panginoon sa buhay ko tipok na fighting spirit laban ng laban di magpatalo sa covid,2021-04-22 09:58:01+00:00,april,2021.0,Facebook,
578,filipino,n,doh naloko lang tao say covid ginagawa nila negosyo ang covid,2021-04-22 10:07:03+00:00,april,2021.0,Facebook,
579,filipino,n,"vaccine is not gamot its immunization of our sytem of the virus katulad po ng malaria, typhoid, polio, tb makinig naman po kayo sa tamang programa la ng pamahalaan kasi kung sa abscbn la kau makikinig at tv 5, ay wala talaga kayong matututunan at panay paninira sa government yan mga yan",2021-04-22 06:45:43+00:00,april,2021.0,Facebook,
580,taglish,n,"eden bulanon kung pampalakas ng immune system, ang vaccines ay hindi kailangan sa mga vegetarians at other healthy living people.",2021-04-22 06:47:36+00:00,april,2021.0,Facebook,
581,taglish,n,"doh, kung talagang safe & tested ang vaccine then bakit may waiver kayo na dapat pirmahan bago bakunahan? then bakit walang mag take ng responsibility kung may mangyaring di maganda sa taong binakonahan? yan ba ang safe & tested? common sense mga kababayan, halimbawa sasabihin ko sa inyo, inumin mo itong gamot na gawa ko para lumakas ka, tapos pipirma kayo ng waiver, at sasabihin ko sa inyo, pag inom nyo ng gamot ko na pangpalakas kung may mangyari sa inyo.",2021-04-22 03:35:19+00:00,april,2021.0,Facebook,
582,english,n,"covid vaccines are not the cure nor for prevention, it will only give you permanent long term side effects in your body and immediate short term side effects or even death to those weak if there is something wrong with you, no one even doctors will say they will guarantee your safety after taking the covid vaccines, they will even promote for other people to have it. they cannot and do not know how to test a person if he is eligible for the covid vaccines, this they do not guarantee either.",2021-04-22 04:48:57+00:00,april,2021.0,Facebook,
583,taglish,n,ayesha ayen alexander lahat ng vaccines hindi effective sa mga variants. ang mga vaccines na lumabas ngaun ay natest at na experiment sa naunang covid19 virus. no way na magiging effective yan sa mga variants na lumalabas ngaun. sa research ko umaabot na sa 200 variants ang nandito na sa pilipinas at mabilis ang pagdami nila. still the most effective way is our innate immune system. be safe!,2021-04-22 00:50:00+00:00,april,2021.0,Facebook,
584,filipino,n,"doh,kahit hindi na magpabakuna kumain lang lagi ng masustansiyang pagkain. maka langhap ng fresh air bakit naman ang mga badjao at palaboy hindi man sila ng ka covid.",2021-04-21 12:34:52+00:00,april,2021.0,Facebook,
