,lang,class,message,created_time,month,year,platform,username
1204,filipino,n,"there is no ""covid 19"" test!!! all claims to be ""tested positive for covid 19"" are false by definition!!! it is a fraudulent claim. rna sequencing tests in no way identifies a specific virus, it doesn't even look at a virus, it looks for damages and repairs to the rna which is a single strand of genetic information where dna is a double strand there's no electron microscopy available.the inventor of the pcr testing being used to diagnose people with ""covid-19"", karry b. mullis, phd, said that the testing should not be used for this purpose, because of how the testing amplifies genetic material by repeatedly doubling it, at a certain point of amplification every single person would test positive for the virus. look for actual ""covid19"" and all you can find is computer generated cartoons which doesn't make sense because we have electron microscopy imagery for all known viruses it's how we positively identify visually all else is guesswork. as far as we know it doesn't exist and many doctors from around the world are complaining about the same thing. i was asked about low resolution rt pcr testing and this is how i replied. low resolution rt pcr testing is just sequencing dna for mutations but it won't identify the catalist that's fine for ruling out like a psa negative is negative but 75 percent of positive psa results are false positives .. if you look at the body as a buffet table loaded with all sorts of food and drinks and some of it gets knocked over by an unknown catalyst (virus) you'll get results telling you there was a crashing sound, the number weight and volume of solids that can be picked up by hand possible if it's chicken pork or beef if pastrami and dark meat chicken have the same weight per volume it's getting identified the same you'll find out the weight and volume of solids they need to be swept up there will be a distinct difference between salt and pepper but maybe not between salt and sugar they make give you the same results. then you'll get the figures of liquids the need to be mopped up and what can be simply wiped up with a paper towel milk is distinctly different from water but maybe identified as wine and gravy could show the same as pudding beer as soda . but most importantly even off all those numbers were all correct based on existing data. you won't know if it was knocked over by grandma fumbling with her purse or two drunks fighting or children playing or a dog chasing a cat or a car chasing a mouse or a wild horse got in and bumped into the table or an earthquake or tornado. you won't know what that catalyst (virus) is to assume you can based on the sound and damage would be that same as assuming zues apollo aphrodite ares and their buddies are throwing thunderbolts down from mount olympus whenever there's a storm. you need to look at the catalyst establishing a baseline for testing takes batteries of tests and months of research and then that particular baseline only applies to that particular patient. we're all genetically different and have repairs from different illnesses that show our endocrineal systems lymphatic systems etc.. there's no reason to be looking at rna and dna were looking for positive cases not ruling out. test kits were found to contain virus, and the tanzanian president, who is a biology professor and researcher, order tests on fruit and animals, which came ""positive"". a truck driver, tested in uganda, found ""positive"", drove to kenia, where they tested him.. and was negative.. (if you actually had an honest test, and had the flu shot, you are very likely to test positive anyhow.. you're being tested under false pretenses and it's a way to illegally collect your genetic data from rna and dna without your consent. that's a violation of the us fourth amendment, and the spirit of constitutions the world over! .https://newtube.app/user/darek/6wckrvp",2020-12-23 14:20:06+00:00,december,2020.0,Facebook,
1205,filipino,n,malapit na mag-10k ang covid19 death toll ng pilipinas,2020-12-22 08:02:43+00:00,december,2020.0,Facebook,
1206,filipino,n,covid free na kami dito sa baranggay namin for 2 months na🙂❤⛪🙏🏾,2020-12-22 08:06:45+00:00,december,2020.0,Facebook,
1207,filipino,n,hahahaha promote pa covid nyo 🤣😂🤣😂,2020-12-21 02:35:16+00:00,december,2020.0,Facebook,
1208,taglish,n,stop lie on covid-19 it's not true...gayahin niyo ang china at italy at mga hindi sumunod sa who at mga nag create ng bacteria na yan turn into virus tas my darating na naman ano yun para market lang inaangkat ang virus tas mag ingat tayo..din wala autopsy sa mga patsy at victema...pera pera virus lang yan...stop vaccine killing me softly yan sa immunity natin...stop caring with lie behind... bullshet,2020-12-21 02:40:10+00:00,december,2020.0,Facebook,
1209,english,n,"hanggang ngayon, sinasaksak pa rin nyo sa utak ng tao ang covid. wag na tayo maglokohan..hanggang ngayon madami pa din nauuto ng dept.of hell, ng world hell organization..ang pasaway ay ang doh, si duque, at ang who. mahigit 400,000 na ang nakarecover pero di nyo binabawas sa bilang, pataas pa din ng pataas. halos lahat ng sakit ngayon ginagawa niyo covid o co-morbidity ng covid.. nagmask na, nag face shield pa,tumataas pa din ang bilang, nag-social distancing na, naglockdown na, nagkulong na sa bahay, nagkaka-covid pa din, nag-ecq, mecq na, nag-quarantine na, nagkaka-covid pa din, lumabas lang, namalengke lang, bumyahe lang, nagka-covid na, nag-rally lang, nagka-covid na, naospital lang, covid agad.. kahit ano gawin ng mga tao, tumataas pa din ang bilang. corruption na ng medical establishment ang nangyayari.. dapat lalo puspusan imbestigasyon sa philhealth, isama na doh at mga kasabwat na ospital na laki ng kinikita nila sa covid covid na yan..sa philhealth, may nagresign na pro walang parusa, may tumakas na nga at walang parusa, doh di nasisilip sa korapsyon, covid is not a virus!.it is a big business by the kurakot people!dati motor barrier, ngayon face shields magkano kinita nila sa 70,000 violators?.. nagpaparty mga tao ngyon sa wuhan, china. niloko lang nila tayong lahat..di nyo na kami mauuto!kung di lng magmumulta, at maabala sa huli, di na kami magfacemask, at faceshield..ilang buwan niyo na tayo pinagkakakitaan. tama na pang-uuto nila sa atin..di tayo mamamatay sa covid, mamamatay tayo sa kakulangan ng oxygen at sakit ng sarili naming mga bacteria at virus na nakakulong sa face mask at face shield.. niloloko lang tayo ng who, sunod naman tayo ng sunod..mga nanguuto!no to face masks!.no to face shields!no to barriers!no to social distancing!no to swab test!no to temp scanning!no to mecq, gcq, ecq, lockdowns & quarantines! panahon na pra imbestigahan mga ospital at mga doctors na dinedeclare sa medical at death certificates na covid ung sakit o kinamatay ng pasyente khit di naman talaga covid.kalokohan ung sinasabi nilang co-morbidity or symptomatic pre-existing conditions of covid.sana masilip ito ng dept.of justice, nbi at pnp..negosyo pera at kurakot na kasi ng philhealth, doh, mga ospital at mga clinics, laboratories at drug stores! khit magresign at mapalitan pa si duque, at khit sino pa presidente, patuloy pa rin nila gagawin yan hanggat may who na nagdidikta sa atin..kumalas tayo at labanan ang who!",2020-12-20 18:32:29+00:00,december,2020.0,Facebook,
1210,filipino,n,covid nasa bulsa today,2020-12-20 20:19:36+00:00,december,2020.0,Facebook,
1211,english,n,sherwin norombaba the sooner 20% are infected and recover the virus will die,2020-12-20 20:36:49+00:00,december,2020.0,Facebook,
1212,taglish,n,these things re happening because of greed/ those in the high er ladder wants more/ they already have everything- mga buwaya sila/ the earth open s up it's mouth and will swallow them up-----,2020-12-20 21:01:53+00:00,december,2020.0,Facebook,
1213,filipino,n,doh tumigil na kayo puke ng ina nyo...kayo na pumapatay ng mga mahihirap...,2020-12-20 21:06:36+00:00,december,2020.0,Facebook,
1214,filipino,n,osoid ammeg wala pong covid lihitimong panloloko sa atin po yan...pabor lahat sa gobyerno lalo na sa mga empleyado...,2020-12-20 21:08:42+00:00,december,2020.0,Facebook,
1215,english,n,can you give us the symptoms of covid19,2020-12-20 00:34:18+00:00,december,2020.0,Facebook,
1216,english,n,pcr is not invented to diagnose a covid patient.,2020-12-20 00:41:06+00:00,december,2020.0,Facebook,
1217,english,n,a member of the australian parliament during a session tested a can of coke which tested positive for covid . shows the tests are b s it's about time people wake up. covid is a plon to take your rights and your freedom ....,2020-12-20 00:51:56+00:00,december,2020.0,Facebook,
1218,taglish,n,"marjorie quiambao tungul lbm, cough, fever, sore throat, walang panlasa at walang pang amoy",2020-12-20 01:00:27+00:00,december,2020.0,Facebook,
1219,filipino,n,dami pera sa covid jockpot mga taga doh,2020-12-20 01:10:04+00:00,december,2020.0,Facebook,
1220,taglish,n,number 27 ang pilipinas ang pinakamaraming covid infected,2020-12-18 02:34:36+00:00,december,2020.0,Facebook,
1221,english,n,dont get vaccine from russia,2020-12-18 02:34:58+00:00,december,2020.0,Facebook,
1222,english,n,waste of time to review all vaccines . select three and focus on their efficacy,2020-12-18 02:36:48+00:00,december,2020.0,Facebook,
1223,filipino,n,kung wala kang sakit wag magpa vaccine!,2020-12-18 02:37:33+00:00,december,2020.0,Facebook,
1224,filipino,n,dapat pala my vaccine na. tinulugan niyo lang hahaba pa ang quarantine ng pinas.,2020-12-18 02:38:10+00:00,december,2020.0,Facebook,
1225,english,n,"hello guys, please watch and hit the like or heart react on this tribute video to all our frontliners, thanks and best regards",2020-12-17 15:08:32+00:00,december,2020.0,Facebook,
1226,taglish,n,beat covid?! bakit hindi inasikaso ang pfizer vaccine? mas gusto talaga ang mas mahal at mala-generic na sinovac from china? mismong china bibili ng bakuna sa ibang bansa.,2020-12-17 15:11:58+00:00,december,2020.0,Facebook,
1227,taglish,n,"wag na kayong sigi papogi doh, sec. duque, dami na namamatay. wer is d' vaccine. why you drop the ball.?? sabi pa nila.. kasama kapa pala dati sa palpak na ding vaxia.. why you drop the ball?? siguro nghahanap kapa ngayon ng mas mura pang vaccine. para ano pa?? nakakuha na nga sila pres. widudo. alam mo sec., galit raba si tatay digong sa mga mandurugas.....!!!!",2020-12-17 21:16:26+00:00,december,2020.0,Facebook,
1228,taglish,n,"beat covid???🤔🤔🤔 actually. . .we already beat it. . .kayo lang itong nagpupumilit na maya covid pa rin! kaya hanggang ngaun doh, utot nyo pink!🤣🤣🤣",2020-12-17 22:00:32+00:00,december,2020.0,Facebook,
1229,taglish,n,covid assisted in. manapla.. good job.. and. active. performance rescue team. / food. assisted. / common. men you'll. a proven. and worth. in. our. society../ / without. cessing. until end...!. mabuhay. ang. manapla..,2020-12-17 22:04:54+00:00,december,2020.0,Facebook,
1230,english,n,"it will never end !!! pandemics, the new weapon against the people. new pandemics are planed for the next 20 years. effective communication about medical countermeasures--including drugs, devices and biologics--is often critical in emergency situations. such communication, however, does not just happen. it must be planned and prepared for. one mechanism to develop communication strategies is through the use of prospective scenarios, which allow readers the opportunity to rehearse responses while also weighing the implications of their actions. this article describes the development of such a scenario: the spars pandemic 2025-2028. steps in this process included deciding on a timeframe, identifying likely critical uncertainties, and then using this framework to construct a storyline covering both the response and recovery phases of a fictional emergency event. lessons learned from the scenario development and how the scenario can be used to improve communication are also discussed.",2020-12-17 22:28:57+00:00,december,2020.0,Facebook,
1231,taglish,n,sana araw-araw maka-report ng mahigit 500 o 1000 pasyente man lang na gumagaling sa sakit na covid19 observe social distancing,2020-12-17 08:03:47+00:00,december,2020.0,Facebook,
1232,taglish,n,juan miguel carbon cadiz malabo pong mangyari yun dahil nasa high risk area po ng covid19 ang metro manila,2020-12-17 08:04:30+00:00,december,2020.0,Facebook,
1233,filipino,n,oh ano na naman taas na naman ang positivity rate at covid cases sa pilipinas. hay salamat wala na sa list ang probinsya ng bulacan at probinsya ng laguna kaso 7ang davao city na naman tapos maraming city sa metro manila kasali sa top 5 new covid cases.,2020-12-17 08:21:45+00:00,december,2020.0,Facebook,
1234,filipino,n,"dumadami na naman ang new cases, yan ang gusto ni st. duque, pati contrata ng vaccine ng pfizer na 10m dossage binitin pa, para dumami pa infected syempre para lumaki ang kita",2020-12-17 08:22:00+00:00,december,2020.0,Facebook,
1235,filipino,n,order ka muna pfizer vaccine,2020-12-17 03:12:04+00:00,december,2020.0,Facebook,
1236,filipino,n,nakapirma na po ba para makabili ng vaccine?,2020-12-17 03:12:18+00:00,december,2020.0,Facebook,
1237,english,n,vaccine are already in america 🇺🇸lets defeat this deadly virus once and for all i want to come back home 🏠 already miss the philippines 😎,2020-12-16 04:15:20+00:00,december,2020.0,Facebook,
1238,english,n,it is also in canada and the government is giving all canadians covid vaccine for free.,2020-12-16 04:17:09+00:00,december,2020.0,Facebook,
1239,filipino,n,hanggang kailan po ang mala teleserye niyong palabas about sa covid na yan 😂,2020-12-16 04:22:43+00:00,december,2020.0,Facebook,
1240,filipino,n,pag me ubo me covid19 na hahahaha....,2020-12-16 04:24:20+00:00,december,2020.0,Facebook,
1241,filipino,n,di samen tatalab yang covid na yan hahaha 😆,2020-12-16 04:24:49+00:00,december,2020.0,Facebook,
1242,taglish,n,mabuti sa new zealand covid free na at wala na covid restrictions. dito meron pa rin covid walang katapusan.,2020-12-15 08:04:34+00:00,december,2020.0,Facebook,
1243,english,n,covid is a fake not really true,2020-12-15 08:11:21+00:00,december,2020.0,Facebook,
1244,filipino,n,peter john fumiyam yap new zealand yan wala masyadong corruption. iba tayo bro. walang kabusugan pinoy pa! politiko o taga media man lintik mahirap busugin.,2020-12-15 08:12:00+00:00,december,2020.0,Facebook,
1245,filipino,n,tanggapin natin na itong covid ay isang virus na bahagi na sa buhay ng tao....health protocol sundin lang hindi naman mahirap ang pagsunod...,2020-12-15 08:12:11+00:00,december,2020.0,Facebook,
1246,taglish,n,rizal at bulacan na naman ulit kasali sa top 5 new covid cases?,2020-12-15 08:17:39+00:00,december,2020.0,Facebook,
1247,filipino,n,lahat sakit covid tawag baliw talaga doh yan,2020-12-15 08:18:01+00:00,december,2020.0,Facebook,
1248,filipino,n,sinira niyo buhay ng tao. di niyo po ba ramdam. kayo mauna mag pa bakuna ha!,2020-12-14 01:06:06+00:00,december,2020.0,Facebook,
1249,filipino,n,kayo ang covid.wala nang covid.puro kayo pera.kaya pera laging nasa isip niyo.wala nang naniniwala sa mga kasinungalihan niyo.,2020-12-13 14:43:56+00:00,december,2020.0,Facebook,
1250,filipino,n,walang katotohanan yang covid nayan ginawang negosyo covid fake,2020-12-13 14:48:01+00:00,december,2020.0,Facebook,
1251,english,n,roll out the vaccine,2020-12-13 15:04:45+00:00,december,2020.0,Facebook,
1252,english,n,"c.o.v.i.d= certificate of vaccine identity by a=1,i=9, artificial intelligence to track all people by microchips.. no privacy & freedom.. god is omnipresent but satan use the technology to deceive mankind by a.i. to track all people human activities & change their dna by innovative vaccines to control human life.. but god he give us freedom & freewill to choose what is good & righteous.. beware of the last greatest deception!",2020-12-13 15:04:52+00:00,december,2020.0,Facebook,
1253,filipino,n,"kapag kayo ay may sipon ubo at trangkaso uminom muna agad ng gamot, huwag agad pumunta sa hospital baka macovid agad!namemera lang sila!!!",2020-12-13 15:10:17+00:00,december,2020.0,Facebook,
1254,filipino,n,kayo ang covid!,2020-12-13 15:10:42+00:00,december,2020.0,Facebook,
1255,filipino,n,virus ng ubo yan! hindi yan covid! nampera lang kayo! ha ha ha,2020-12-13 15:12:03+00:00,december,2020.0,Facebook,
1256,taglish,n,kaya ko to of course. only the stupid gonna get vaccine. the beast have a good tactic,2020-12-13 15:26:47+00:00,december,2020.0,Facebook,
1257,filipino,n,alam na ng mga tao 220.kahit atake sa puso covid ang nilalagay nyo resulta pra lang sa pera.,2020-12-12 15:29:15+00:00,december,2020.0,Facebook,
1258,filipino,n,doh sinungaling minamanipula nila walang bukang bibig kundi pandemic at tinatakot pa mga pilipino hoy hindi paba tapos agenda nyo ha hindi na maka pag hanap buhay ng maayos mga pilipino ha,2020-12-12 15:35:22+00:00,december,2020.0,Facebook,
1259,filipino,n,utang na loob. kapag mahina natural immune system ng tao ay talaga namang lagi na lang respiratory illnesses dumadapo sakit sa tao. ginawa nyo nang hanapbuhay yan. panloloko sa tao kahit lagnat lang ay covid na. pasalamat kayo mababait ang lahing filipino at mahaba pasensya. ewan ko lang kung gutom na sila kasi kayo walang kabusugan,2020-12-12 15:59:33+00:00,december,2020.0,Facebook,
1260,filipino,n,wag sana kayong magalit sakin naisip ko lang kasi kung bakit hindi pumatok ang sars morscov aids at iba pa.nung time nila at ngayon covid world wide agad agad..naalala ko lang wala pa kasing social media nung time na yun.saka naisip ko lang din bakit kaya sa wuhan lang nagka covid at hindi kumalat sa china naalala ko lang uli ban nga pala fb sa china🤔🤔🤔🤔,2020-12-12 16:27:55+00:00,december,2020.0,Facebook,
1261,filipino,n,kayo jan ma'am dapat yung vaccine ang ina update nila kung ano na ang status hindi yung trigger nila lagi ang pag taas nang kaso eh samantala malaki na ang nagamit na pera para pag aralan ang sinasabing covid mag malapit na mag isang taon,2020-12-12 17:23:22+00:00,december,2020.0,Facebook,
1262,filipino,n,stop!.. pukingina quiboloy paistapin mo doh sa nag nangdiputa kasinungalingan sa covid kahit tolongges ka magda-dalawang isip na ko sa kabwisitan mo..,2020-12-12 18:06:55+00:00,december,2020.0,Facebook,
1263,filipino,n,dondon macapagal correct! ginagamit lang covid para magkapera sila,2020-12-12 18:27:45+00:00,december,2020.0,Facebook,
1264,english,n,when you rolling out the vaccine were vaccinating filipinos in the uk already,2020-12-12 18:53:24+00:00,december,2020.0,Facebook,
1265,filipino,n,simula ng dumating ang covid ang ibang sakit nawawala na puro nalang covid wala namang katotohanan nyang lintik na covid na yan.,2020-12-12 19:33:52+00:00,december,2020.0,Facebook,
1266,filipino,n,yung rapid test niyo saka swab test  ang ayusin niyo dyan nanggagaling yung covid na sinasabi niyo mga hunghang..,2020-12-11 08:24:27+00:00,december,2020.0,Facebook,
1267,filipino,n,nagsasayang lng kayo ng oras wala na kami paki dyan sa covid niyo..,2020-12-11 08:25:54+00:00,december,2020.0,Facebook,
1268,taglish,n,#doh why is doh planning to stop use of torotot and fireworks for health reasons. but you have never made any program or included in covid19 protocol ban of cigarette smoking? #dole even explicitly was against total ban of smoking as it will add to unemployment. pero yun mga mawawalan ng business for banning torotot and fireworks ok lang sa inyo? im confused. mas dangerous ba ang torotot sa smoking? #bidasolusyon #healthypilipinas #sro #dzmmteleradyo,2020-12-11 11:11:54+00:00,december,2020.0,Facebook,
1269,english,n,"#stopcovidterrorism #stopvaccineterrorism please share, copy and paste urgent!! proof!! trying to illegally force vaccinate healthy people based on an evil hoax!!!",2020-12-11 11:41:03+00:00,december,2020.0,Facebook,
1270,filipino,n,una ibakuna tapos isakuna,2020-12-11 12:13:16+00:00,december,2020.0,Facebook,
1271,filipino,n,actually tapos na sana tong covid-19 ehh kaso pinapalala ng mga taga doh😠. kahit naman di covid sana kayo na ang na covid yung totoong covid..,2020-12-10 16:14:56+00:00,december,2020.0,Facebook,
1272,filipino,n,matagal na walang covid. doh wag na kayo manloko sa tao mga bwisit kayo,2020-12-10 18:27:12+00:00,december,2020.0,Facebook,
1273,filipino,n,lahat ng namatay sa pinas puro covid na.ano ba yan doh?,2020-12-10 18:28:05+00:00,december,2020.0,Facebook,
1274,english,n,reported side effects of pfizer vaccine. ☹,2020-12-10 08:13:02+00:00,december,2020.0,Facebook,
1275,filipino,n,"laban bawi nalang ang labanan sa covid,pag sunday marami naman gagaling yan",2020-12-10 08:14:16+00:00,december,2020.0,Facebook,
1276,taglish,n,1.383 cases today 133 recovery and 24 death malapit na ang kapaskuhan patuloy parin ang pagtaas baba ng cases pagdating ng sunday 20+ parin ang active kailan matapos to natawa ako sa nabasa ko sa diyaryo marami na ang walang tiwala sa vaccine na bakuna si saint doque na ang nagsasabi na to na wala ng tiwala ang tao ng dahil sa dengvaxia talaga naman report nga ng doh araw araw nakakaduda na bakuna pa kaya para maniwala talaga kami na safe ang bakuna nayan unahin turukan si doque at roque after 5 years kapag buhay pa ang dalawa saka na tayo ubod ng sinungaling yan si doque at roque kaya dapat lang mauna sila turukan diba madlang people,2020-12-10 08:19:50+00:00,december,2020.0,Facebook,
1277,english,n,vaccine is coming,2020-12-10 08:25:01+00:00,december,2020.0,Facebook,
1278,filipino,n,wag na kayo magtest para wala nang possitive. san ba galing ang covid na yan diba sa mga tinitest niyo... ano yan doctor laway.. may gamot naman sa ubo sa sipon sa lagnat.. bakit kailangan niyo pa magpa rapid test swab test.. hindi ba tumatalab sa inyo ang gamot na biogesic.. bioflu.. neozep.. medicol.. expired na ba mga gamot na yan.. kundi ba naman kayo mga tanga.,2020-12-10 08:28:24+00:00,december,2020.0,Facebook,
1279,taglish,n,pwede ba stop counting covid no to pandemic plandemic meron,2020-12-10 08:30:02+00:00,december,2020.0,Facebook,
1280,taglish,n,syempre ang family and relatives eh paano naman namin sila makaka sama kung bawal ang gatherings sa inyo na din mismo nang galing na bawal ang gatherings i think i have to take this chance and opportunity to tell this saan naman kayo naka kita ng covid na gumagaling at madaming recoveries ibig sabihin wala talagang covid kasi lahat ng symptoms na sinasabi niyo matagal ng sakit yan sa katawan ng tao tsaka tsaka yung totoo iniba niyo lang yung name term dahil ang covid nasa malalamig lang yang lugar eh ang init init dito sa atin sa pilipinas,2020-12-09 07:38:59+00:00,december,2020.0,Facebook,
1281,filipino,n,bwisit na covid to ohh,2020-12-09 02:48:37+00:00,december,2020.0,Facebook,
1282,filipino,n,wag na kayong maggaling halos lahat ng covid response niyo palpak ayusin niyo mga protocols yong hindi nag hihirap ang tao.,2020-12-07 10:54:19+00:00,december,2020.0,Facebook,
1283,taglish,n,"sinasaksak na naman nyo sa utak ng tao ang covid..wag na tayo maglokohan.. hanggang ngayon madami pa din nauuto ng doh, ng who..ang pasaway ay ang doh, si duque, at ang who. mag-math tayo. mahigit 441,000 na ang nkarecover pero di binabawas sa bilang, pataas pa din ng pataas.. inuuto, tinatakot at niloloko nyo lng kami.. halos lahat ng sakit ngyon ginagawa nyo covid o co-morbidity ng covid.. nagmask na, nag face shield pa,tumataas pa din ang bilang, nag-social distancing na, naglockdown na, nagkulong na sa bahay, nagkaka-covid pa din, nag-ecq, mecq na, nag-quarantine na, nagkaka-covid pa din, lumabas lang, namalengke lng, bumyahe lng, nagka-covid na, nag-rally lng, nagka-covid na, naospital lng, covid agad.. kahit ano gawin ng mga tao, tumataas pa din ang bilang. corruption na ng medical establishment ang nangyayari.. dapat lalo puspusan imbestigasyon sa philhealth, isama na doh at mga kasabwat na ospital na laki ng kinikita nila sa covid covid na yan..sa philhealth, may nagresign na pro walang parusa, may tumakas na nga at walang parusa, doh di nasisilip sa korapsyon, covid is not a virus!.it is a big business by the kurakot people!dati motor barrier, ngyon face shields mgkano kinita nila sa 70,000 violators?.. nagpaparty mga tao ngyon sa wuhan, china. niloko lng nila tayong lhat..di nyo na kmi mauuto!kung di lng magmumulta, at maabala sa huli, di na kami magfacemask, at faceshield..ilang buwan nyo na tayo pnagkkakitaan. tama na pang-uuto nila sa atin..di tayo mamamatay sa covid, mamamatay tayo sa kakulangan ng oxygen at sakit ng sarili naming mga bacteria at virus na nakakulong sa face mask at face shield.. buking na sila! niloloko lng tau ng who, sunod naman tayo ng sunod..mga nanguuto!no to face masks!no to face shields!no to barriers!no to social distancing!no to swab test!no to temp scanning!no to mecq, gcq, ecq, lockdowns & quarantines! panahon na pra imbestigahan mga ospital at mga doctors na dinedeclare sa medical at death certificates na covid ung sakit o kinamatay ng pasyente khit di naman tlga covid.kalokohan ung sinasabi nilang co-morbidity or symptomatic pre-existing conditions of covid.sana masilip ito ng dept.of justice, nbi at pnp..negosyo pera at kurakot na kasi ng philhealth, doh, mga ospital at mga clinics, laboratories at drug stores! khit magresign at mapalitan pa si duque, at khit sino pa presidente, patuloy pa rin nila gagawin yan hanggat may who na nagdidikta sa atin..kumalas tayo at labanan ang who!",2020-12-07 10:58:43+00:00,december,2020.0,Facebook,
