,lang,class,message,created_time,month,year,platform,username
0,taglish,a,"Panic disorder is scary 🥺 I experienced it myself during this pandemic. You'll find yourself nalang na parang gusto mo nalang umiyak dahil sa takot . Lagi kang kinakabahan , hindi ka makatulog ng ayos at sobra akong magisip .",2021-01-24T23:01:40+0000,January,2021.0,Twitter,
1,filipino,a,"pandemic anxiety talaga parang iniisip ko pa lang na bbyahe ako para pumasok sa work and maeexpose sa random na mga tao, nakakatakot umuwi. :--((",2020-05-07T16:42:30+0000,May,2020.0,Twitter,
2,filipino,n,buti satin wala current sa baguio meron nanaman 😢😢,2020-04-15 09:19:51+00:00,April,2020.0,Facebook,
3,taglish,n,Much that I want to say wow... But Wala pa tayong massive testing. Huwag tayong maging kampante. Baguio had no new cases for thirteen days ... And then biglang merong dalawang magkasunod,2020-04-15 10:19:08+00:00,April,2020.0,Facebook,
4,filipino,a,Kung mag extend naman po pwede naman po pauwiin niyo mo na mga nag bobording wala na po kaming makain mamatay po kami sa gutom sana po may makakabasa nito salamat po,2020-04-16 05:27:50+00:00,April,2020.0,Facebook,
5,filipino,a,Gcq....parang normal na po...nakakatok lang..kasi sabay sabay na po mga tao na lumalabas....tsaka mga papasok po ng trinidad open na open....ok lang po ba yun......wag na po hintayin ang second wave........salamat po....,2020-05-27 11:18:15+00:00,May,2020.0,Facebook,
6,filipino,a,nakakatakot parin lumabas kasi may nag positive sa itogon ucab proper,2020-05-30 05:02:39+00:00,May,2020.0,Facebook,
7,filipino,n,tama ka paano matatapos itong Lockdown kung Papasok mga galing abroad,2020-05-11 09:25:29+00:00,May,2020.0,Facebook,
8,filipino,n,Paano Naman mapipigilan ang covid Kung may nakakapasok na galing ibang bansa....,2020-05-17 01:04:42+00:00,May,2020.0,Facebook,
9,filipino,a,Any updates kung nag negative sa swab test ang mga na close contacts ng mga nagpositive? Mahirap kasi econtain yung virus kung matagal mismong mga close contact parang sila pa yung pasaway kahit naka lockdown pa sila.,2020-06-16 03:24:59+00:00,June,2020.0,Facebook,
10,filipino,a,Sana yung vegetable truck wag NG pababain..sana hanggang boundary lang tpos may magpick up na taga baba din nga truck..para sa safety NG lahat... opinion ko lang yan,2020-06-07 03:37:12+00:00,June,2020.0,Facebook,
11,taglish,a,OMG. DAPAT DI TAYO MGCQ TAYO. BACK TO GCQ. DAPAT HINDI TAYO KAMPANTI MGA KAKAILYANS. DI NATIN MAKITA ANG KALABAN. SO PRAYERS IS POWERFUL TO THOSE WHO GOT INFECTED. AND FOR ALL OF US. STAY HOME AND BE SAFE. GOD BLESS EVERYONE. AMEN.,2020-06-17 14:26:57+00:00,June,2020.0,Facebook,
12,taglish,n,We may know po kung saang area nakadetail yong nagpositive na municipal employee.,2020-06-18 02:53:36+00:00,June,2020.0,Facebook,
13,english,a,Ibalik nalang ang ecq.,2020-06-18 04:27:51+00:00,June,2020.0,Facebook,
14,english,a,With the movement of people so does the virus.,2020-06-18 04:04:20+00:00,June,2020.0,Facebook,
15,filipino,a,"Rems Tilika nawalan ng saysay yung ""to heal as one act"" because of that mass gathering alam na nga nilang dumarami kaso dito la trinidad 😰 Sana lang wala ng maidagdag pa na bagong kaso. ",2020-06-18 13:43:46+00:00,June,2020.0,Facebook,
16,filipino,a,saan kaya naka duty yang mga security guards na yan baka nakasalamuha ko? Maraming positive sa La Trinidad pero parang wala na akong nababalitaan na may lockdows sa mga baranggay na may infected. Buti pa sa ibang munisipyo ng Benguet talagang binibigyan nila ng pansin. Dito sa La Trinidad kulang kulang pa information.,2020-08-05 10:26:22+00:00,August,2020.0,Facebook,
17,filipino,a,So what is your course of action po? Last week pa pong maraming nagpositive dito sa LT pero wala kaming naririnig na lockdown or disinfection? Give us an info na Pwede naming malaman baka nakasalamuha namin yang mga nagpositive lalo na yang mga SGs. Asikasuhin niyo naman kahit konti!,2020-08-05 12:37:46+00:00,August,2020.0,Facebook,
18,filipino,a,saan po sa puguis ang nagpositive?paki inspect po ung ibang minimart at barber shop sa puguis kung nasusunod ang protocols bago pa kumalat.,2020-08-01 02:31:22+00:00,August,2020.0,Facebook,
19,filipino,n,Just wondering why wala na lock down sa mga lugar na to?,2020-08-01 04:42:40+00:00,August,2020.0,Facebook,
20,taglish,n,"Cases are increasing but no lockdown.  Ang dami ba naman kasing gumagala kahit madaling araw , paanung hindi mahahawa ang mga tao kung hindi stricto ang munisipyo mismo,  sa sinasakupan nito",2020-08-18 00:19:08+00:00,August,2020.0,Facebook,
21,filipino,a,Sana po iditalyado po ninyo mga barangays na lifted na ng lockdown. Na may coresponding kung kailan na lift. Baka wala yata lockdown sa trinidad kase di strikto parang normal lang kahit may positive,2020-08-10 06:58:33+00:00,August,2020.0,Facebook,
22,english,a,Praying for everyone fast recovery. Sana if possible avoid wearing DIY mask instead use surgical mask and faceshield.😣😷😷😷,2020-08-13 08:59:26+00:00,August,2020.0,Facebook,
23,filipino,n,"almost 2 to 3 months nako dito sa loob ng boarding at lumalabas lang sa araw ng check up ko tapos nung nag ka free swap test yun din ang huling labas ko and then kinabukasan may result agad na ganon daw,samantalang ang kasama ko na nag pa swab test pareho lang ang pag gamit namin ng plate baso kutyara,at after 4days palang lumabas ang result negative pano mangyayari yun kayo na humusga",2020-12-21 06:01:23+00:00,December,2020.0,Facebook,
24,filipino,n,ba yan habang lumalamig ang panahon padami naman ng padami ang case😔😔😔,2021-01-15 09:42:27+00:00,January,2021.0,Facebook,
25,filipino,a,Pakiexplain po pano tumalon bigla ang cases,2021-02-27 11:18:16+00:00,February,2021.0,Facebook,
26,english,a,From 84 to 176 in one day. What happened?,2021-02-26 19:10:59+00:00,February,2021.0,Facebook,
27,filipino,n,sila lang dapat magpa bakuna hindi nila mapiplit yung ayaw,2021-01-19 14:10:39+00:00,january,2021.0,Facebook,
28,filipino,n,"may recoveries pala ang covid-19, ayaw niyo lang sabihin kung ano ang gamot...😁😁😁",2021-01-19 14:15:58+00:00,january,2021.0,Facebook,
29,filipino,a,kung nararamdaman mo na my covid ka dun k nlng magpaswab test ndi ung wala kang nararamdaman dun k nila isswab test dahil lng sa pera paano kung nagpswabtest k negative k pagktapos nkaramdam k ng sipon dahil sa klima kapag nagpahospital ka cgurado my covid ka dahil sa pera mahal kc magpswabtest eh talaga naman nkkahawa ang sipon kc virus un,2021-01-30 16:26:28+00:00,january,2021.0,Facebook,
30,english,a,"in our municipality, seniors are top priority. concerned with limited trials for seniors. if vaccine brands are random, how can seniors be assured that the vaccine is contraindicated for vulnerable seniors?",2021-01-30 01:41:40+00:00,january,2021.0,Facebook,
31,filipino,n,midwives papa bigay nyo ng bakuna (injection) e hindi nga authorized sila magbigay ng gamot sa ospital di po ba?,2021-01-29 11:24:22+00:00,january,2021.0,Facebook,
32,filipino,a,di kayo mauna mga pa turok mga D.O.H..mauna kayo mg pa turok sa bakuna..kayo na nagsabi safe diba?so ipakita niyo samin mga tao na safe talaga..,2021-01-29 11:32:37+00:00,january,2021.0,Facebook,
33,filipino,a,mag february na mukang aabutin pa yan ng december wala na naman mamasko nabobobo na mga estudyante sa kaka module dami na din walang trabaho mamatay na tayo sa gutom di sa covid na sinasabi na yan.,2021-01-28 14:51:08+00:00,january,2021.0,Facebook,
34,filipino,n,mamamatay kami sa gutom hindi sa covid,2021-01-28 14:56:12+00:00,january,2021.0,Facebook,
35,filipino,n,puro kayo covid kahit namatay sa ibang sakit sasabihin covid. kahit my ubo sipon kahit hindi naman covid ipapalabas nyo covid ..mga pulubi sa kalsada nangangalakal ng basura walang mask fshield ni dinga tinatamaan ng covid kuno. wala ka nga mkikitang taong grasa jan sa kalsada na nakabulagta na namatay sa covid eh.... anu ba kayo who doh. bagsak na ekonomiya ng bansa trillion na utang ng pilipinas dahil sa pandemic. sana binibigyan din ng pansin ng gobyerno natin yan mga nawalan ng trabaho hanapbuhay hindi yung puro covid nalang lagi pinapansin nyo. bagsak na ekonomiya abah,2021-01-28 10:41:22+00:00,january,2021.0,Facebook,
36,filipino,a,andami nang namamatay,2021-01-28 08:05:34+00:00,january,2021.0,Facebook,
37,filipino,n,"lahat na klase ng sakit known to earth ay tumigil muna para pagbigyan ang covid. lahat na namatay ,kahit nasagasaan ng kareton, ay covid ang dahilan. covid is money!",2021-01-28 08:10:02+00:00,january,2021.0,Facebook,
38,filipino,a,dami na naman tapos namamatay dami na din,2021-01-27 08:05:51+00:00,january,2021.0,Facebook,
39,taglish,a,"hay naku libo libo ang nadadagdagan ng covid cases sa buong philippines. wala kaming kasalanan sa inyo mga government. masunurin na nga kami sa health protocols pero mataas padin ang new cases covid sa bansa. ano ba iyan sobrang taas na nga ang total confirmed covid cases 500,000+ na nga eh. hayna hindi naman kami lumalabag sa health protocols, hindi rin naman kami lumalabas pero bakit ganoon padin mataas padin ang covid cases sa philippines.",2021-01-27 08:05:56+00:00,january,2021.0,Facebook,
40,filipino,a,ano tapos pag nag pa check up sasabihin niyo may covid eh di pinatay niyo rin kami kayo nalang mag pa turok bakit pa kami mag papa turok alam naman naming na simpleng sipon lang pag nagpa check up sasabihin covid gumising nga kayo baka bina bangungot kayo,2021-01-27 05:47:14+00:00,january,2021.0,Facebook,
41,filipino,a,hindi lahat ng pilipino mag avail ng bakunang yan kung in the first place palang marami ng namatay sa bakuna niyo gusto ko pang mabuhay para sa family ko without your injections,2021-01-27 05:48:11+00:00,january,2021.0,Facebook,
42,filipino,a,nakuu kapareho din pala ng sintomas pgka may covid ka! kayo na muna para malaman namin na wala ngang side effects! hindi naman tayo pare pareho ng kalusugan para tanggapin ng katawan ang bakuna na yan!,2021-01-27 05:49:11+00:00,january,2021.0,Facebook,
43,filipino,n,dami ng namamatay,2021-01-26 08:02:58+00:00,january,2021.0,Facebook,
44,filipino,a,ang daming namamatay lately. sana hindi na dumami yung mga kaso ng uk variant. 🤞,2021-01-26 08:05:40+00:00,january,2021.0,Facebook,
45,filipino,n,panibagng sakit na naman.isang napakalaking kasinungalingan na naman.pahihirapan na naman ang sambayanan.. wala daw gamot pero marami ang gumagaling.ano kayang kaisipan meron itong doh at mga doctor...,2021-01-25 22:45:07+00:00,january,2021.0,Facebook,
46,filipino,a,ako ayaw ko magpa vaccine baka dto ako mamatay hindi ako namayta sa covid dto sa vaccines ka matigok,2021-01-25 11:25:07+00:00,january,2021.0,Facebook,
47,filipino,a,ayaw kong mag pa inject dito sa vaccine kase imbes na dika mamatay sa covid mamatay ka na dito sa vaccine. bahala na dyan.,2021-01-25 11:39:01+00:00,january,2021.0,Facebook,
48,filipino,a,ja ma ica tama po marami na kaming nakikitang video na mamatay daw tayo kapag magpapabakuna ng vaccine,2021-01-25 11:47:27+00:00,january,2021.0,Facebook,
49,filipino,a,christina mendavia.kase pinapanood ko rin sa news eh.kaya mas better pa na kusa nalang na mamatay tayo kaysa mamatay ka sa vaccine o covid..,2021-01-25 11:50:35+00:00,january,2021.0,Facebook,
50,english,a,is it true that vaccine can alter our dna? thats why theyre pushing to vaccine the world in order to fulfill the goal of the antichrist to manipulate us?,2021-01-25 11:00:51+00:00,january,2021.0,Facebook,
51,filipino,a,"13 na gumaling, diba wala pa ho vaccine? nako po baka pag nag pa vaccine tayo lethal injection. na ho yon!",2021-01-25 08:11:04+00:00,january,2021.0,Facebook,
52,filipino,p,dami ng namatay dyan sa bakuna na yan,2021-01-24 12:51:02+00:00,january,2021.0,Facebook,
53,filipino,a,dami araw araw pumanaw dahil sa covid baka naman hindi covid ang natigok ginawa niyo covid doh mula si duque secretary puro na covid ang sakit pati natigok covid wala ng normal na sakit at natigok jesus christ my god,2021-01-23 08:06:54+00:00,january,2021.0,Facebook,
54,english,n,"i'm a concerned citizen and i just wanna ask when is the sputnik and pfizer vaccines be delivered in the country, i hope that someone will answer me",2021-01-23 03:29:43+00:00,january,2021.0,Facebook,
55,filipino,a,wala na tapos na!! di na na contain.. history repeat itself.. ganyan din nung mga december 2019 biglang bumulusok ang may covid.. lalo na ngayon na mas matindi maka infect ang variant ng covid na yan..,2021-01-22 15:19:20+00:00,january,2021.0,Facebook,
56,filipino,a,nakakatakot naman,2021-01-22 11:21:24+00:00,january,2021.0,Facebook,
57,filipino,a,dumarami na naman ang active cases ng covid 19 dahil yan sa pagiging kampante ng mga pilipino sa covid 19,2021-01-21 08:09:03+00:00,january,2021.0,Facebook,
58,filipino,a,bakunahan nyo sarili wag kami,2021-01-20 11:54:48+00:00,january,2021.0,Facebook,
59,filipino,a,"magpabakuna para sa ikakamatay ng tao, bakit ngayon sa norway daming namatay, sobrang hirap na ngayon sa bansa natin dagdagan, pa sa vaccine na walang kasiguraduhan😡😡",2021-01-20 12:54:19+00:00,january,2021.0,Facebook,
60,filipino,n,balita: 23 katao namatay pala sa bakuna sa covid 19 sa bansang norway,2021-01-20 13:06:38+00:00,january,2021.0,Facebook,
61,filipino,a,pwede po bang paki-explain maigi? bakit po sa mild cases e 50% lang ang efficacy tapos sa severe cases 100% ????? ituturok po ba ang vaccine sa may covid?? paki-explain pong maigi yan!!,2021-02-27 12:17:16+00:00,february,2021.0,Facebook,
62,filipino,a,ano po ang pinaka safe na vaccine ngayon yon tested at talagang napatunayan na.?,2021-02-27 12:17:53+00:00,february,2021.0,Facebook,
63,filipino,a,grabe ang dami na araw araw kakatakot.,2021-02-26 08:07:50+00:00,february,2021.0,Facebook,
64,filipino,a,"sige doh pananakot pa more para magpabakuna mga tao sa ""pekeng sinovac"" ....😥😥😥 hindi kayo titigil ng pananakot hanggat kumikita kayo sa pekeng gamot at mga produkto ng chinese ... mga kurap kayo!",2021-02-26 08:08:35+00:00,february,2021.0,Facebook,
65,filipino,a,bukas 100+ na naman mamatay,2021-02-25 08:17:59+00:00,february,2021.0,Facebook,
66,filipino,n,alam niyo ba ang sinovac covid vaccines recommended ng fda/doh sa 18-59 years old pero hindi sa health care workers dahil sa mababa niya efficacy ayon sa results ng brazil clinical trials. well,,february,2021.0,Facebook,
67,filipino,n,kaya pala yung ofw na umuwi ng cebu dalawang beses na turukan nang vaccines sa ibang bansa paguwi nagswab test positive... sa covid...,2021-02-22 13:36:38+00:00,february,2021.0,Facebook,
68,filipino,a,immunity basket sa mga vaccine company walang kwenta. . sino hahabulin sa mga vaccine side effect at vaccine death effect? eh sino gagastos pag matamaan ng side effect? gobyerno tuta na ng mga vaccine company.. biruin mo pag meron namatay at nagkasakit sa side effect di sila mahabol.. 🤣😅,2021-02-26 04:08:03+00:00,february,2021.0,Facebook,
69,filipino,a,hahaha lakas tama nito dika aabot ng negros occidental pag naturukan ka ng bakuna malamang sa langit kana makakaranas ng normal,2021-02-22 01:20:43+00:00,february,2021.0,Facebook,
70,filipino,n,bukas ilalabas ang isyu ng mga dumaraming gumaling sa covid,2021-02-21 14:02:13+00:00,february,2021.0,Facebook,
71,filipino,a,maraming namatay sa covid ngayong araw!,2021-02-20 08:03:27+00:00,february,2021.0,Facebook,
72,filipino,a,tama para mabawasan na ang population natin dahil yong mga nabakunahan na yung iba patay na,2021-02-19 10:59:39+00:00,february,2021.0,Facebook,
73,filipino,a,vaccine pa more....kayo nakaisip doh kayo magpabakuna..papatayin niyo yung mga tao sa bakuna niyo...covid covid....kung totoo yan dapat lahatin dito samin nagkahawa hawa na...dikit dikit bahay dito...kagaguhan niyo,2021-02-19 11:07:14+00:00,february,2021.0,Facebook,
74,filipino,a,ang daming patay doh!! covid lahat yan?,2021-02-19 08:01:27+00:00,february,2021.0,Facebook,
75,filipino,n,wala pang vaccine,2021-02-19 08:14:47+00:00,february,2021.0,Facebook,
76,filipino,a,hirap mag decide sa vaccine walang assurance kasi baka sa iba ok sayo hindi kasi depende sa katawan mo kung kakayanin yung side effect na normal daw na mararanasan after maturukan..mahihilo masusuka lagnat body pains..after maranasan yan tsaka iturok yung 2nd dose..gaano po ba kaepekto ang gamot at gaano kasigurado na walang mangyayaring masama.,2021-02-19 03:47:35+00:00,february,2021.0,Facebook,
77,filipino,a,paano nabigyan ng covid vaccine ang positive na beneficiary since asymptomatic yung tao meron ba itong effect sa katawan? thank you,2021-02-19 03:49:01+00:00,february,2021.0,Facebook,
78,filipino,a,mga ofw vaccinated nag positve pa yan kabado..,2021-02-18 12:53:39+00:00,february,2021.0,Facebook,
79,filipino,a,mas kabado ako pag nagugutom hindi ako makakatulog kapag may kabag ang tiyan ko kabado ako baka mamatay ako na gutom dahil sa covid na ito.,2021-02-18 12:59:58+00:00,february,2021.0,Facebook,
80,filipino,a,mas delikado pa sa mismong virus yang bakuna niyo,2021-02-18 13:05:30+00:00,february,2021.0,Facebook,
81,filipino,a,nakakatakot naman baka di makaya ng katawan ang side effect,,february,2021.0,Facebook,
82,filipino,a,"barth poland korek magka isa sambayanan ""no to vaccine""....payag kaba gawing expiremento???????tandaan niyo walang panagutan ang gumawa ng bakuna....ty ang buhay niyo hahaha",2021-02-18 01:07:42+00:00,february,2021.0,Facebook,
83,filipino,a,mga ingat tayo sa bakuna kasi yan talaga ang delikado yan talaga ang nakakamatay kasi marami ng namatay sa bakuna hindi lang pinalabas sa balita,2021-02-17 02:31:31+00:00,february,2021.0,Facebook,
84,english,a,i read this in a german newspaper‼i translate it for you: whistleblower from the berlin old people's home: the terrible death after the vaccination. for the first time there is an eyewitness report from a berlin old people's home on the situation after the vaccination. eight out of 31 senior citizens died there within four weeks of the first vaccination with the biontech / pfizer vaccine product comirnaty. the first death occurred after just six days,,february,2021.0,Facebook,
85,filipino,a,pabakuna ka tas kinabukasan may sakit kana sa dugo😥,2021-02-16 12:49:26+00:00,february,2021.0,Facebook,
86,english,a,but you can get covid after a vaccine you can still transmit it waste of time vaccine,2021-03-29 10:06:16+00:00,march,2021.0,Facebook,
87,filipino,a,sabi ko na nga ehh aabot ng 10k yan ehh pag nag ecq na sabay mag 11k naman yan nako nakakatakot na,2021-03-29 08:01:50+00:00,march,2021.0,Facebook,
88,filipino,a,hindi ako natatakot sa fake covid ang kinakatakutan ko yung magugutom dahil nawalan ng kita,2021-03-28 18:50:42+00:00,march,2021.0,Facebook,
89,filipino,a,bakit sa frontline kayo tutok bigyan ninyo lahat ng mamayan na may gusto ng vaccine dito sa ibang bansa ang bilis nila mag ayos ng vaccine online registration lang ikaw hahanap hospital kong saan gusto kong may open sa vaccine na date ang mga hospital my bayad ba pa vaccine sa pinas baka gsto rin pagkakitaan nila,2021-03-28 02:48:47+00:00,march,2021.0,Facebook,
90,filipino,a,kailangan nyo kung sino ang ayaw or gusto sa bakuna.hindi nga mandatory pero no vaccines no work subra na panggipit nyo sa mga tao.wala ng karapatan mag desisyon sa sarili.tandaan nyo lahat kagaguhan nyo babalik sa inyo.,2021-03-28 03:10:01+00:00,march,2021.0,Facebook,
91,filipino,a,pwede ba ang ibang sakit hindi i convert sa covid.kasi pag may namatay covid agad ano ba kayo panginoon...mag aral kayo sa katotohan bago kayo magsalita..,2021-03-27 14:57:16+00:00,march,2021.0,Facebook,
92,english,a,do you have an online database of vaccine reactions because you are vaccinating people of unlicensed and experimental covid vaccines that have been harming and killing people worldwide??,2021-03-27 05:09:04+00:00,march,2021.0,Facebook,
93,english,a,"what drug then is ok to be used to treat covid-19? seems like everything that could work to prevent it is labeled ""dangerous"" by you guys.",2021-03-26 08:17:30+00:00,march,2021.0,Facebook,
94,filipino,a,tigil nyo na po ang kalokohan na yan maawa na kayo sa mga kagaya namin mahihirap,2021-03-26 07:48:40+00:00,march,2021.0,Facebook,
95,filipino,a,grabe na sinasabi ng doh di niyo na ba titigilan takutin ang mga tao sa gutom kami mamatay dahil gusto niyo palaging i lockdown ang mga lugar di covid kundi kupit ang gusto niyo 😠,2021-03-26 07:54:31+00:00,march,2021.0,Facebook,
96,filipino,a,alam nyo kung totoong may covid at nakakamatay ubos na sana dito sa amin yong mga taong pagala gala sa kalye kaso sa observation ko mas lalo silang dumadami alam nyo kung bakit dahil di na kinakaya ang hirap ng buhay depression na te! kung sino payong taong nakaupo na ka aircon mag hapon,,march,2021.0,Facebook,
97,filipino,a,ask ko lang po kung pwede ako magpa vaccine? meron kasi ako allergy both sa medicine and food?,2021-03-24 02:17:08+00:00,march,2021.0,Facebook,
98,filipino,a,mamamatay muna ako bago niyo ako maturukan nyan.,2021-03-22 12:17:20+00:00,march,2021.0,Facebook,
99,filipino,a,pwede po ba ako mag pa bakuna may maintenance po ako losartan 50 mg at allergy po ako mefenamic na may ibupropen? thanks po sana masagot ang katanungan ko.,2021-03-30 01:59:14+00:00,march,2021.0,Facebook,
100,filipino,a,pag may maintenance ako para high blood constipation at diabetis pwede ba ako magpavaccine senior ako 90 years old,2021-03-30 02:01:43+00:00,march,2021.0,Facebook,
101,filipino,a,hanggang ngayon wala pa rin bakuna sa amin. where na you?,2021-04-29 10:11:25+00:00,april,2021.0,Facebook,
102,filipino,a,"magpa vaccine pero hindi pa din babalik sa normal ang buhay kailangang mag face mask , distancing, andami pa ding restrictions dahil pwede ka pa ding makahawa at mahawaan, e para saan pang nagpa vaccine ka",2021-04-29 10:35:26+00:00,april,2021.0,Facebook,
103,filipino,a,kailan po kami magkaka bakuna sa legazpi city....senior citizen po ako hanggang ngayon hindi pa nababakunahan please doh bigyan mo naman kami dito sa legazpi kahit anong klaseng bakuna gusto pa namin mabuhay.please lang doh....thanks,2021-04-29 00:18:58+00:00,april,2021.0,Facebook,
104,filipino,a,doh kailan kaya makakuha ng vaccine ang mga seafarer di kami maka alis ng walang vaccine mandatory sa kompanya namin lahat na ng lugar na may nag vavaccine pinuntahan ko na pero wala pa daw ang pang ofw at seafarer doque ano na may pamilya din kami jusko,2021-04-29 00:30:44+00:00,april,2021.0,Facebook,
105,filipino,a,manny ic hays kaya delikadong mag pa bakuna pag di kinaya ng katawan,2021-04-28 13:05:13+00:00,april,2021.0,Facebook,
106,filipino,a,wala na pong flu at pneumonia; covid na ang bagong sakit ngayon,2021-04-28 13:28:58+00:00,april,2021.0,Facebook,
107,filipino,a,gusto ko pong magpabakuna ng para flu at pneumonia ngunit laging ubos at kulang ang bakuna sa healthcenter dito sa bacood sta. mesa. sana may announcement kayo kung anong araw laging may available na bakuna. senior citizen po.,2021-04-28 13:39:16+00:00,april,2021.0,Facebook,
108,filipino,a,ang daming vaccine para daw sa mga sakit pero bakit ang mga tao magkakasakit parin at mamamatay.mapupuno nalang sa turok ang katawan ng tao pero mamamatay parin .so anong silbi ng bakuna?may bakuna bang makapag prevent ng kamatayan?,2021-04-28 13:42:31+00:00,april,2021.0,Facebook,
109,filipino,a,paano nyo nalalaman na nakapagbigay ng proteksyon ang covid vaccine laban sa covid kung hindi nyo nalalaman kung ano ba talaga ang tunay na gamot sa covid?wala pa kayong proof na epektibo and covid vaccine laban sa covid dahil on trial pa lang sa tao lahat ng covid vaccine kung baga experimental palang lahat.,2021-04-28 13:06:17+00:00,april,2021.0,Facebook,
110,filipino,a,"kailan po ba magkakabakuna ang mga seniors ng bulacan? madami pong cases kami at katabi lang po namin ang manila, madaming doon nag wowork at umuuwi araw araw pa rin. sana po matugunan niyo agad ang aming kailangan. salamat po.",2021-04-28 13:53:33+00:00,april,2021.0,Facebook,
111,filipino,n,kahit na sino pa ang ka partner ng doh...kung experimental vaccines yang pino promote nyo...ay maraming salamat na lang po. sa inyo na po yan🤣,2021-04-28 05:31:59+00:00,april,2021.0,Facebook,
112,english,a,i'm 65 and i don't like any kind of this vaccines‼😒,2021-04-27 12:35:37+00:00,april,2021.0,Facebook,
113,filipino,a,basahin mo po ang mga posts ng fox29 news sa fb tungkol sa side effects ng mga vaccines na yan,2021-04-27 13:15:45+00:00,april,2021.0,Facebook,
114,filipino,p,doh. pakisabi kay sec duque mag impose na ng travel ban from india. napakataas ng covid cases don per day at napakataas din ng mortality rate. dapat matuto na kayo ng leksyon from previous year. maawa kayo sa mga filipino.,2021-04-27 11:09:33+00:00,april,2021.0,Facebook,
115,english,a,the isolation faclity must be constructed covid 19 will be here from now on,2021-04-27 06:03:39+00:00,april,2021.0,Facebook,
116,english,a,no to experimental vaccines.,2021-04-27 01:41:50+00:00,april,2021.0,Facebook,
117,filipino,a,"bakit halos lahat merong ""against"" na nakasulat dun sa vaccine efficacy... yung sinovac walang nakasulat na against, nagtatanong lang po kung ano ang ibig sabihin nung sa sinovac. thank you po",2021-04-25 13:04:16+00:00,april,2021.0,Facebook,
118,filipino,a,"doh, dapat kailangan ang bakuna please😁",2021-04-25 16:08:20+00:00,april,2021.0,Facebook,
119,filipino,a,walang silbe ang bakuna kung may side effect ito pabakuna ka tapos mahawaan ka pa rin pala ng covid useless lang yan dapat yan gamot mahal ng bakuna wala naman palang kasiguraduhan ang buhay pagnaturukan ka,2021-04-25 11:09:49+00:00,april,2021.0,Facebook,
120,english,a,"the conventional vaccine is useless in battling the virus that continues to mutate. is doh ready for a mutation that is fatal and fast spreading, like the brasil and india variant? this is not far to occur because until now the infection has not yet flattened. wake up doh, before it's too late. 😭😭😭",2021-04-25 08:47:14+00:00,april,2021.0,Facebook,
